{
  "$schema":"https://json-schema.org/draft/2020-12/schema","$id":"https://cloverapps.ai/schemas/launch-studio/0.1.0/executor-work-order.schema.json","title":"Codex executor work-order proposal","type":"object","additionalProperties":false,
  "required":["documentType","schemaVersion","recordId","sessionId","workspaceId","projectId","charterId","repository","baseCommit","worktreeBranch","contextPackHash","impactScanHash","handoffAuthorityReferenceId","allowedPaths","prohibitedEffects","deliverables","testPlan","repairLoopBudget","modelCapabilityPolicy","resolvedModelId","sessionUsageCeilingId","progressEventContract","stopConditions","rollback","returnReceiptRequirements","status","executed","recordHash","synthetic","consequentialAuthorityGranted"],
  "properties":{"documentType":{"const":"clover-executor-work-order"},"schemaVersion":{"const":"0.1.0"},"recordId":{"$ref":"common.schema.json#/$defs/id"},"sessionId":{"$ref":"common.schema.json#/$defs/id"},"workspaceId":{"$ref":"common.schema.json#/$defs/id"},"projectId":{"$ref":"common.schema.json#/$defs/id"},"charterId":{"$ref":"common.schema.json#/$defs/id"},"repository":{"type":"string","pattern":"^[A-Za-z0-9](?:[A-Za-z0-9-]*[A-Za-z0-9])?/[A-Za-z0-9](?:[A-Za-z0-9._-]*[A-Za-z0-9])?$"},"baseCommit":{"type":"string","pattern":"^[a-f0-9]{40}$"},"worktreeBranch":{"type":"string","pattern":"^[A-Za-z0-9][A-Za-z0-9._/-]*$"},"contextPackHash":{"$ref":"common.schema.json#/$defs/hash"},"impactScanHash":{"$ref":"common.schema.json#/$defs/hash"},"handoffAuthorityReferenceId":{"$ref":"common.schema.json#/$defs/id"},"allowedPaths":{"$ref":"common.schema.json#/$defs/stringArray"},"prohibitedEffects":{"$ref":"common.schema.json#/$defs/stringArray"},"deliverables":{"$ref":"common.schema.json#/$defs/stringArray"},"testPlan":{"$ref":"common.schema.json#/$defs/stringArray"},"repairLoopBudget":{"type":"integer","minimum":0},"modelCapabilityPolicy":{"type":"array","minItems":1,"items":{"enum":["high-reasoning","implementation","mechanical","deterministic"]},"uniqueItems":true},"resolvedModelId":{"const":null},"sessionUsageCeilingId":{"$ref":"common.schema.json#/$defs/id"},"progressEventContract":{"$ref":"common.schema.json#/$defs/stringArray"},"stopConditions":{"$ref":"common.schema.json#/$defs/stringArray"},"rollback":{"$ref":"common.schema.json#/$defs/stringArray"},"returnReceiptRequirements":{"$ref":"common.schema.json#/$defs/stringArray"},"status":{"enum":["proposed","held"]},"executed":{"const":false},"recordHash":{"$ref":"common.schema.json#/$defs/hash"},"synthetic":{"type":"boolean"},"consequentialAuthorityGranted":{"const":false}}
}
