{"allowedPaths":["apps/clover-launch-studio/package.json","apps/clover-launch-studio/package-lock.json","apps/clover-launch-studio/tsconfig.json","apps/clover-launch-studio/next.config.mjs","apps/clover-launch-studio/src/app/layout.tsx","apps/clover-launch-studio/src/app/page.tsx","apps/clover-launch-studio/src/app/globals.css","apps/clover-launch-studio/src/app/api/health/route.ts","apps/clover-launch-studio/src/middleware.ts","apps/clover-launch-studio/src/app/sign-in/[[...sign-in]]/page.tsx","apps/clover-launch-studio/src/app/access-denied/page.tsx","apps/clover-launch-studio/src/app/api/sessions/route.ts","apps/clover-launch-studio/src/app/api/sessions/[sessionId]/route.ts","apps/clover-launch-studio/src/app/api/sessions/[sessionId]/events/route.ts","apps/clover-launch-studio/src/app/api/sessions/[sessionId]/export/route.ts","apps/clover-launch-studio/src/app/api/sessions/[sessionId]/restore/route.ts","apps/clover-launch-studio/src/app/api/sessions/[sessionId]/handoff/route.ts","apps/clover-launch-studio/src/components/launch-studio-shell.tsx","apps/clover-launch-studio/src/components/transcript-editor.tsx","apps/clover-launch-studio/src/components/progress-timeline.tsx","apps/clover-launch-studio/src/components/decision-rail.tsx","apps/clover-launch-studio/src/components/preview-pane.tsx","apps/clover-launch-studio/src/lib/config.ts","apps/clover-launch-studio/src/lib/auth.ts","apps/clover-launch-studio/src/lib/acl.ts","apps/clover-launch-studio/src/lib/crypto.ts","apps/clover-launch-studio/src/lib/storage.ts","apps/clover-launch-studio/src/lib/launch-session-service.ts","apps/clover-launch-studio/src/lib/handoff-codex-adapter.ts","apps/clover-launch-studio/test/launch-studio-app.test.mjs","apps/clover-launch-studio/test/launch-studio-browser.test.mjs"],"baseCommit":"e5688c771d384d80a8c723cfa655298ce8257889","charterId":"build_charter_phase_b_02a_action_004_001","consequentialAuthorityGranted":false,"contextPackHash":"6e507670879827182705c8d8a6402802943982e6c42240cad10f6e39268a5076","deliverables":["One future isolated worktree on feature/clover-launch-studio-private-owner-app-v0.2a-20260824.","One local source commit whose changed paths are an exact subset of the ordered 31-path boundary.","One future source-bound Handoff receipt with exact source, branch, base, commit, tree and preservation evidence."],"documentType":"clover-executor-work-order","executed":false,"handoffAuthorityReferenceId":"handoff-action:004:launch-studio-phase-b-source","impactScanHash":"36b3ad5285e05e6e647e9c6925470d84a806739d9245aa0b599b8fa6a2904f56","modelCapabilityPolicy":["high-reasoning","implementation","mechanical","deterministic"],"progressEventContract":["Emit evidence-only source preparation and receipt progress.","Use provider-neutral progress-event delivery with a local adapter; never emit hidden reasoning or token traces."],"prohibitedEffects":["workflow-change","provider-resource-creation","oauth-registration","storage-creation","chatgpt-app-create-or-refresh","vercel-preview","gateway-change-or-promotion","private-data-ingestion","real-participant-or-workspace-creation","validation","repair","push","pull-request-publication","merge","production-deployment","message","external-message","payment","purchase","spending"],"projectId":"clover-launch-studio-private-owner","recordHash":"a9eb72a672dbb0cc5193f86237e52deb97ec3b6084c5cd154a8be47ae5edcbcc","recordId":"executor_work_order_phase_b_02a_action_004_001","repairLoopBudget":0,"repository":"chrisdortch/first","resolvedModelId":null,"returnReceiptRequirements":["Source must equal chrisdortch/first:main@e5688c771d384d80a8c723cfa655298ce8257889 with tree 4c84129b4fb5ea098ac9d2325bc2cb387857a471.","Candidate branch must equal feature/clover-launch-studio-private-owner-app-v0.2a-20260824 with base e5688c771d384d80a8c723cfa655298ce8257889.","Candidate commit and tree must be exact, non-null and source-bound.","Changed paths must be an exact subset of the ordered 31 allowed paths; workflow path excluded.","Provider, private-data, authority, cost and preservation readback must remain zero-effect.","Return HOLD pending a separately minted validation Action."],"rollback":["Delete only the isolated worktree and unpushed local candidate branch after exact readback.","Do not touch protected main, workflows or any pre-existing provider resource."],"schemaVersion":"0.1.0","sessionId":"launch_session_phase_b_02a_action_004_proposal_001","sessionUsageCeilingId":"session_budget_phase_b_02a_action_004_001","status":"proposed","stopConditions":["Any protected-main, capsule, path, Work Order hash or source identity differs.","Any validation, repair, push, PR, provider, preview, private-data or external effect would occur.","Any path outside the exact 31 or any persistent configuration change is required.","Stop after the same failure signature occurs twice.","Stop after one repair loop produces no new evidence.","Maximum future repair loops remains three; Action 004 has no repair authority."],"synthetic":false,"testPlan":["Do not run application, browser, Node-matrix, provider or workflow validation under Action 004.","A later validation Action must bind this Work Order, the complete Acceptance Contract and the exact resulting candidate commit.","Provider-specific and browser tests remain future/not-run.","Clerk: candidate provider, unselected","Neon: candidate provider, unselected","Vercel Blob: candidate provider, unselected","Vercel hosting: candidate provider, unprovisioned"],"workspaceId":"workspace_phase_b_02a_action_004_proposal_001","worktreeBranch":"feature/clover-launch-studio-private-owner-app-v0.2a-20260824"}
